{
  "schema_version": 1,
  "rhythm_profile_id": "01JZRHYTHM00000000000001",
  "workspace_id": "demo-workspace",
  "trace_id": "trace-rhythm-1",
  "target_id": "01JZCHPLAN000000000000001",
  "status": "approved",
  "label": "退婚压迫三段式",
  "climax_index": 0.86,
  "conflict_index": 0.78,
  "dialogue_ratio": 0.42,
  "description_ratio": 0.28,
  "battle_ratio": 0,
  "information_density": 0.65,
  "suspense_index": 0.74,
  "reward_count": 2,
  "emotion_curve": [
    { "beat": 1, "intensity": 0.35, "summary": "压抑铺垫" },
    { "beat": 2, "intensity": 0.68, "summary": "冲突加压" },
    { "beat": 3, "intensity": 0.92, "summary": "立誓爆点" }
  ],
  "created_at": "2026-07-12T01:03:00Z",
  "updated_at": "2026-07-12T01:05:00Z"
}
